{
  "$schema": "http://json-schema.org/draft-07/schema#",
  "title": "Family Tree Data Schema",
  "type": "object",
  "required": ["meta", "persons", "relationships", "events", "media"],
  "properties": {
    "meta": {
      "type": "object",
      "required": ["familyName", "version", "rootPersonId"],
      "properties": {
        "familyName": { "type": "string" },
        "version": { "type": "string", "pattern": "^\\d+\\.\\d+\\.\\d+$" },
        "rootPersonId": { "type": "string", "pattern": "^[a-zA-Z0-9_]+$" },
        "privacy": {
          "type": "object",
          "properties": {
            "hideLivingContactInfo": { "type": "boolean" },
            "hideLivingDOBYear": { "type": "boolean" },
            "publicViewAllowed": { "type": "boolean" }
          }
        }
      }
    },
    "persons": {
      "type": "array",
      "items": {
        "type": "object",
        "required": ["id", "firstName", "lastName", "gender", "status"],
        "properties": {
          "id": { "type": "string", "pattern": "^[a-zA-Z0-9_]+$" },
          "firstName": { "type": "string", "minLength": 1 },
          "lastName": { "type": "string", "minLength": 1 },
          "gender": { "enum": ["M", "F", "X"] },
          "status": { "enum": ["living", "deceased", "unknown"] },
          "maritalStatus": { "enum": ["single", "married", "divorced", "widowed", "unknown"] },
          "birthDate": { "type": ["string", "null"], "pattern": "^\\d{4}(-\\d{2}(-\\d{2})?)?$" },
          "deathDate": { "type": ["string", "null"], "pattern": "^\\d{4}(-\\d{2}(-\\d{2})?)?$" },
          "location": { "type": ["string", "null"] },
          "commonName": { "type": ["string", "null"] },
          "commonNameMr": { "type": ["string", "null"] },
          "firstNameMr": { "type": ["string", "null"] },
          "lastNameMr": { "type": ["string", "null"] },
          "biography": { "type": ["string", "null"] },
          "profilePhoto": { "type": ["string", "null"] },
          "backgroundPhoto": { "type": ["string", "null"] },
          "tags": { "type": "array", "items": { "type": "string" } },
          "private": { "type": "boolean" }
        }
      }
    },
    "relationships": {
      "type": "array",
      "items": {
        "type": "object",
        "required": ["id", "type"],
        "properties": {
          "id": { "type": "string", "pattern": "^[a-zA-Z0-9_]+$" },
          "type": { "enum": ["marriage", "parent-child", "adoption", "step-parent", "foster"] }
        }
      }
    },
    "events": {
      "type": "array",
      "items": {
        "type": "object",
        "required": ["id", "type", "title"],
        "properties": {
          "id": { "type": "string", "pattern": "^E\\d+$" },
          "type": { "enum": ["birth", "death", "marriage", "divorce", "education", "career", "migration", "medical", "award", "other"] },
          "date": { "type": ["string", "null"] }
        }
      }
    },
    "media": {
      "type": "array",
      "items": {
        "type": "object",
        "required": ["id", "type", "filename"],
        "properties": {
          "id": { "type": "string", "pattern": "^M\\d+$" },
          "type": { "enum": ["photo", "video", "document", "audio"] },
          "filename": { "type": "string" }
        }
      }
    },
    "scrapbook": {
      "type": "object",
      "additionalProperties": {
        "type": "array",
        "items": {
          "type": "object",
          "required": ["date", "caption", "photos", "tags"],
          "properties": {
            "date": { "type": "string" },
            "caption": { "type": "string" },
            "photos": {
              "type": "array",
              "items": { "type": ["string", "null"] }
            },
            "tags": {
              "type": "array",
              "items": { "type": "string" }
            }
          }
        }
      }
    }
  }
}
