{
  "meta": {
    "familyName": "Sathawane's Family Tree",
    "description": "A genealogy record of the Sathawane family.",
    "version": "1.0.0",
    "createdAt": "2026-09-02",
    "updatedAt": "2026-09-11",
    "rootPersonId": "HITESH_JYOTI_SHANKAR_SATHAWANE",
    "privacy": {
      "hideLivingContactInfo": true,
      "hideLivingDOBYear": false,
      "publicViewAllowed": false
    }
  },
  "persons": [
    {
      "id": "HITESH_JYOTI_SHANKAR_SATHAWANE",
      "firstName": "Hitesh",
      "fatherName": "Shankar",
      "motherName": "Jyoti",
      "lastName": "Sathawane",
      "maidenName": null,
      "gender": "M",
      "status": "living",
      "maritalStatus": "married",
      "birthDate": "1985-12-29",
      "birthPlace": "Nagpur",
      "deathDate": null,
      "deathPlace": null,
      "occupation": "Service",
      "education": "B.E., Master in Financial Management",
      "location": "Dombivli, India",
      "commonName": null,
      "commonNameMr": null,
      "firstNameMr": "हितेश",
      "lastNameMr": "साठवणे",
      "biography": null,
      "profilePhoto": "https://pub-51dbdc7eb2f346efb74d0ec6e3b08829.r2.dev/profile_hitesh_jyoti_shankar_sathawane.png",
      "backgroundPhoto": "https://pub-51dbdc7eb2f346efb74d0ec6e3b08829.r2.dev/background_hitesh_jyoti_shankar_sathawane.png",
      "tags": [],
      "private": false
    },
    {
      "id": "SWATI_CHAYA_BHIMRAO_BIRADAR",
      "firstName": "Swati",
      "fatherName": "Bhimrao",
      "motherName": "Chaya",
      "lastName": "Biradar",
      "maidenName": "Biradar",
      "gender": "F",
      "status": "living",
      "maritalStatus": "married",
      "birthDate": "1991-07-01",
      "birthPlace": "Latur",
      "deathDate": null,
      "deathPlace": null,
      "occupation": "Home Maker",
      "education": "B.E, Master in Financial Management",
      "location": "Dombivli, India",
      "commonName": null,
      "commonNameMr": null,
      "firstNameMr": "स्वाती",
      "lastNameMr": "बिरादार",
      "biography": null,
      "profilePhoto": "https://pub-51dbdc7eb2f346efb74d0ec6e3b08829.r2.dev/profile_swati_chaya_bhimrao_biradar.jpg",
      "backgroundPhoto": "https://pub-51dbdc7eb2f346efb74d0ec6e3b08829.r2.dev/background_swati_chaya_bhimrao_biradar.jpg",
      "tags": [],
      "private": false
    },
    {
      "id": "SHANKAR_VATSALA_SAMPATHRAO_SATHAWANE",
      "firstName": "Shankar",
      "fatherName": "Sampathrao",
      "motherName": "Vatsala",
      "lastName": "Sathawane",
      "maidenName": null,
      "gender": "M",
      "status": "living",
      "maritalStatus": "married",
      "birthDate": "1954-08-27",
      "birthPlace": "Nagpur",
      "deathDate": null,
      "deathPlace": null,
      "occupation": null,
      "education": null,
      "location": null,
      "commonName": null,
      "commonNameMr": null,
      "firstNameMr": "शंकर",
      "lastNameMr": "साठवणे",
      "biography": null,
      "profilePhoto": null,
      "backgroundPhoto": "https://pub-51dbdc7eb2f346efb74d0ec6e3b08829.r2.dev/background_shankar_vatsala_sampathrao_sathawane.jpg",
      "tags": [],
      "private": false
    },
    {
      "id": "JYOTI_MANAROMA_BHASKARRAO_WAGHMARE",
      "firstName": "Jyoti",
      "fatherName": "Bhaskarrao",
      "motherName": "Manaroma",
      "lastName": "Waghmare",
      "maidenName": "Waghmare",
      "gender": "F",
      "status": "deceased",
      "maritalStatus": "married",
      "birthDate": "1963-03-23",
      "birthPlace": "Nagpur",
      "deathDate": "2017-05-23",
      "deathPlace": null,
      "occupation": null,
      "education": null,
      "location": null,
      "commonName": "Baby",
      "commonNameMr": null,
      "firstNameMr": "ज्योती",
      "lastNameMr": "वाघमारे",
      "biography": null,
      "profilePhoto": "https://pub-51dbdc7eb2f346efb74d0ec6e3b08829.r2.dev/profile_jyoti_manaroma_bhaskarrao_waghmare.jpg",
      "backgroundPhoto": "https://pub-51dbdc7eb2f346efb74d0ec6e3b08829.r2.dev/background_jyoti_manaroma_bhaskarrao_waghmare.jpg",
      "tags": [],
      "private": false
    },
    {
      "id": "DHRUV_SWATI_HITESH_SATHAWANE",
      "firstName": "Dhruv",
      "fatherName": "Hitesh",
      "motherName": "Swati",
      "lastName": "Sathawane",
      "maidenName": null,
      "gender": "M",
      "status": "living",
      "maritalStatus": "single",
      "birthDate": "2021-11-08",
      "birthPlace": "Dombivli",
      "deathDate": null,
      "deathPlace": null,
      "occupation": null,
      "education": null,
      "location": null,
      "commonName": null,
      "commonNameMr": null,
      "firstNameMr": "ध्रुव",
      "lastNameMr": "साठवणे",
      "biography": null,
      "profilePhoto": "https://pub-51dbdc7eb2f346efb74d0ec6e3b08829.r2.dev/profile_dhruv_swati_hitesh_sathawane.jpg",
      "backgroundPhoto": null,
      "tags": [],
      "private": false
    },
    {
      "id": "ARJUN_SWATI_HITESH_SATHAWANE",
      "firstName": "Arjun",
      "fatherName": "Hitesh",
      "motherName": "Swati",
      "lastName": "Sathawane",
      "maidenName": null,
      "gender": "M",
      "status": "living",
      "maritalStatus": "single",
      "birthDate": "2025-12-02",
      "birthPlace": "Dombivli",
      "deathDate": null,
      "deathPlace": null,
      "occupation": null,
      "education": null,
      "location": null,
      "commonName": null,
      "commonNameMr": null,
      "firstNameMr": "अर्जुन",
      "lastNameMr": "साठवणे",
      "biography": null,
      "profilePhoto": null,
      "backgroundPhoto": null,
      "tags": [],
      "private": false
    },
    {
      "id": "SAMPATHRAO_BIJABAI_SOMAJI_SATHAWANE",
      "firstName": "Sampathrao",
      "fatherName": "Somaji",
      "motherName": "Bijabai",
      "lastName": "Sathawane",
      "maidenName": null,
      "gender": "M",
      "status": "deceased",
      "maritalStatus": "married",
      "birthDate": "1674-06-06",
      "birthPlace": "Bhandara",
      "deathDate": "2012-11-26",
      "deathPlace": null,
      "occupation": null,
      "education": null,
      "location": null,
      "commonName": null,
      "commonNameMr": null,
      "firstNameMr": "संपतराव",
      "lastNameMr": "साठवणे",
      "biography": null,
      "profilePhoto": null,
      "backgroundPhoto": "https://pub-51dbdc7eb2f346efb74d0ec6e3b08829.r2.dev/background_sampathrao_bijabai_somaji_sathawane.jpg",
      "tags": [],
      "private": false
    },
    {
      "id": "MAHADEO_VATSALA_SAMPATHRAO_SATHAWANE",
      "firstName": "Mahadeo",
      "fatherName": "Sampathrao",
      "motherName": "Vatsala",
      "lastName": "Sathawane",
      "maidenName": null,
      "gender": "M",
      "status": "living",
      "maritalStatus": "married",
      "birthDate": "1958-02-06",
      "birthPlace": "Nagpur",
      "deathDate": null,
      "deathPlace": null,
      "occupation": null,
      "education": null,
      "location": null,
      "commonName": null,
      "commonNameMr": null,
      "firstNameMr": "महादेव",
      "lastNameMr": "साठवणे",
      "biography": null,
      "profilePhoto": null,
      "backgroundPhoto": null,
      "tags": [],
      "private": false
    },
    {
      "id": "SUDHAKAR_VATSALA_SAMPATHRAO_SATHAWANE",
      "firstName": "Sudhakar",
      "fatherName": "Sampathrao",
      "motherName": "Vatsala",
      "lastName": "Sathawane",
      "maidenName": null,
      "gender": "M",
      "status": "living",
      "maritalStatus": "married",
      "birthDate": "1961-10-06",
      "birthPlace": "Nagpur",
      "deathDate": null,
      "deathPlace": null,
      "occupation": null,
      "education": null,
      "location": null,
      "commonName": "Chottu",
      "commonNameMr": null,
      "firstNameMr": "सुधाकर",
      "lastNameMr": "साठवणे",
      "biography": null,
      "profilePhoto": null,
      "backgroundPhoto": "https://pub-51dbdc7eb2f346efb74d0ec6e3b08829.r2.dev/background_sudhakar_vatsala_sampathrao_sathawane.jpg",
      "tags": [],
      "private": false
    },
    {
      "id": "RATNAKAR_VATSALA_SAMPATHRAO_SATHAWANE",
      "firstName": "Ratnakar",
      "fatherName": "Sampathrao",
      "motherName": "Vatsala",
      "lastName": "Sathawane",
      "maidenName": null,
      "gender": "M",
      "status": "living",
      "maritalStatus": "married",
      "birthDate": "1972-07-09",
      "birthPlace": "Nagpur",
      "deathDate": null,
      "deathPlace": null,
      "occupation": null,
      "education": null,
      "location": null,
      "commonName": "Dhermendra",
      "commonNameMr": null,
      "firstNameMr": "रत्नाकर",
      "lastNameMr": "साठवणे",
      "biography": null,
      "profilePhoto": null,
      "backgroundPhoto": "https://pub-51dbdc7eb2f346efb74d0ec6e3b08829.r2.dev/background_ratnakar_vatsala_sampathrao_sathawane.jpg",
      "tags": [],
      "private": false
    },
    {
      "id": "ALKA_VATSALA_SAMPATHRAO_SATHAWANE",
      "firstName": "Alka",
      "fatherName": "Sampathrao",
      "motherName": "Vatsala",
      "lastName": "Sathawane",
      "maidenName": "Sathawane",
      "gender": "F",
      "status": "living",
      "maritalStatus": "married",
      "birthDate": "1964-10-27",
      "birthPlace": "Nagpur",
      "deathDate": null,
      "deathPlace": null,
      "occupation": null,
      "education": null,
      "location": null,
      "commonName": null,
      "commonNameMr": null,
      "firstNameMr": "अलका",
      "lastNameMr": "साठवणे",
      "biography": null,
      "profilePhoto": null,
      "backgroundPhoto": "https://pub-51dbdc7eb2f346efb74d0ec6e3b08829.r2.dev/background_alka_vatsala_sampathrao_sathawane.jpg",
      "tags": [],
      "private": false
    },
    {
      "id": "KALINDI_MANAROMA_BHASKARRAO_WAGHMARE",
      "firstName": "Kalindi",
      "fatherName": "Bhaskarrao",
      "motherName": "Manaroma",
      "lastName": "Waghmare",
      "maidenName": "Waghmare",
      "gender": "F",
      "status": "living",
      "maritalStatus": "married",
      "birthDate": "1955-10-02",